{
  "$schema": "http://json-schema.org/draft-07/schema#",
  "$id": "https://composa.ui/annotation.schema.v1.json",
  "title": "Composa @composa/ui component annotation (contract v1)",
  "description": "One machine-readable annotation per component. It is the single source the docs site renders and the enforcement test checks, so a component is 'done' only when a valid, truthful annotation exists. Fields follow the design-system-slots DoD (intent, slots, tokens, states, a11y, enforce); swap_boundary is optional and deprioritized per the owner.",
  "type": "object",
  "required": ["component", "category", "intent", "slots", "states", "tokens", "a11y", "enforce", "code"],
  "additionalProperties": true,
  "properties": {
    "component": { "type": "string", "description": "Exported component name." },
    "category": { "type": "string" },
    "archetype": {
      "type": "string",
      "enum": ["primitive", "composite", "overlay", "shell", "template", "utility"],
      "description": "The component's kind. Sets which sections its doc requires, per docs/design-system/section-rubric.md. `template` is a composable screen-shape pattern with content slots (a page you fill), distinct from `shell` (the app frame)."
    },
    "intent": { "type": "string", "description": "One line: what this is for." },
    "guidance": {
      "type": "string",
      "description": "Bounded editorial prose (<= ~120 words): the non-obvious behavioural / placement / wiring advice the structured fields can't carry. Rendered as the Guidance section."
    },
    "anatomy": {
      "type": "array",
      "description": "The component's visible parts, in reading order. Rendered as a numbered legend (Carbon's anatomy). Each entry is one numbered part.",
      "items": {
        "type": "object",
        "required": ["part", "description"],
        "additionalProperties": false,
        "properties": {
          "part": { "type": "string", "description": "The part's name." },
          "description": { "type": "string", "description": "What it is / does." }
        }
      }
    },
    "rules": {
      "type": "array",
      "description": "Authored usage rules, each rendered twice (the Carbon/REM bridge): as a human Do/Don't card pair in the docs, and — where machine-checkable — as an adherence check named by `enforced_by`. Authored once here so the prose and the enforcement cannot drift.",
      "items": {
        "type": "object",
        "required": ["id", "do", "dont"],
        "additionalProperties": false,
        "properties": {
          "id": { "type": "string", "description": "kebab-case rule slug, unique within the component." },
          "do": { "type": "string", "description": "What to do." },
          "dont": { "type": "string", "description": "What not to do — name the correct alternative." },
          "enforced_by": { "type": "string", "description": "The adherence-check id that enforces this rule (a check the contract test runs), or 'prose-only' when it is not machine-checkable." }
        }
      }
    },
    "examples": {
      "type": "array",
      "description": "Concrete usage patterns (mainly for composites). Rendered as the Examples section.",
      "items": {
        "type": "object",
        "required": ["title", "description"],
        "additionalProperties": false,
        "properties": {
          "title": { "type": "string" },
          "description": { "type": "string" },
          "story": { "type": "string", "description": "Optional Storybook story id for a live example." }
        }
      }
    },
    "slots": {
      "type": "object",
      "description": "Named composition points a host fills. Empty object for a primitive with no slots."
    },
    "states": {
      "type": "array",
      "description": "The visual/interaction states the component renders.",
      "items": { "type": "string" }
    },
    "tokens": {
      "type": "object",
      "description": "Which design tokens each visual property binds to. No hardcoded values."
    },
    "a11y": { "type": "object" },
    "enforce": {
      "type": "object",
      "description": "Machine-checkable claims the annotation makes about the real component. The enforcement test verifies these against the rendered output / source.",
      "required": ["role"],
      "additionalProperties": true,
      "properties": {
        "role": {
          "type": "string",
          "description": "The ARIA role or native element the component exposes (e.g. 'application', 'complementary', 'tablist', 'button')."
        },
        "ariaRole": {
          "type": "boolean",
          "description": "true when `role` is an ARIA role attribute the rendered tree must carry (checked by render); false/absent when it is a native element name."
        },
        "tokensOnly": {
          "type": "boolean",
          "description": "true asserts the component source contains no hardcoded hex color (Foundations). The test reads the source and verifies it."
        }
      }
    },
    "swap_boundary": {
      "type": "object",
      "description": "Optional. Deprioritized per owner (2026-09-23)."
    },
    "code": {
      "type": "object",
      "required": ["import", "example"],
      "properties": {
        "import": { "type": "string" },
        "example": { "type": "string" }
      }
    }
  }
}
